[
    {
        "ClubName": "Aalborg Håndbold",
        "Country": "Denmark",
        "PhoneNumber": "+45 96 352030",
        "Email": "jl@aalborghaandbold.dk",
        "YearEstablished": 2000,
        "HomeArena": "Sparekassen Danmark Arena",
        "League": "Herreligaen",
        "ChampionshipsWon": 14,
        "Website": "www.aalborghaandbold.dk",
        "TeamColors": {
            "Light": "Light blue",
            "Dark": "Red"
        },
        "HeadCoach": {
            "FirstName": "Maik",
            "LastName": "Machulla"
        },
        "Players": [
            {
                "FirstName": "Niklas",
                "LastName": "Landin Jacobsen",
                "Position": "Goalkeeper",
                "JerseyNumber": 1,
                "Nationality": "Denmark"
            },
            {
                "FirstName": "Sebastian",
                "LastName": "Barthold",
                "Position": "Left Wing",
                "JerseyNumber": 19,
                "Nationality": "Norway"
            },
            {
                "FirstName": "Kristian",
                "LastName": "Bjørnsen",
                "Position": "Right Wing",
                "JerseyNumber": 6,
                "Nationality": "Norway"
            },
            {
                "FirstName": "Bjarki",
                "LastName": "Jóhannsson",
                "Position": "Left Back",
                "JerseyNumber": 23,
                "Nationality": "Iceland"
            },
            {
                "FirstName": "Mads",
                "LastName": "Hoxer Hangaard",
                "Position": "Right Back",
                "JerseyNumber": 14,
                "Nationality": "Denmark"
            },
            {
                "FirstName": "Thomas",
                "LastName": "Arnoldsen",
                "Position": "Centre Back",
                "JerseyNumber": 7,
                "Nationality": "Denmark"
            },
            {
                "FirstName": "René",
                "LastName": "Antonsen",
                "Position": "Line Player",
                "JerseyNumber": 22,
                "Nationality": "Denmark"
            }
        ]
    },
    {
        "ClubName": "Barça",
        "Country": "Spain",
        "PhoneNumber": "+34 93 4967247",
        "Email": "xavier.ocallaghan@fcbarcelona.cat",
        "YearEstablished": 1942,
        "HomeArena": "Palau Blaugrana",
        "League": "Liga Asobal",
        "ChampionshipsWon": 185,
        "Website": "www.fcbarcelona.cat",
        "TeamColors": {
            "Light": "Lime yellow",
            "Dark": "Blue red stripped"
        },
        "HeadCoach": {
            "FirstName": "Antonio Carlos",
            "LastName": "Ortega Pérez"
        },
        "Players": [
            {
                "FirstName": "Emil",
                "LastName": "Nielsen",
                "Position": "Goalkeeper",
                "JerseyNumber": 40,
                "Nationality": "Denmark"
            },
            {
                "FirstName": "Aitor",
                "LastName": "Ariño Bengoechea",
                "Position": "Left Wing",
                "JerseyNumber": 13,
                "Nationality": "Spain"
            },
            {
                "FirstName": "Blaz",
                "LastName": "Janc",
                "Position": "Right Wing",
                "JerseyNumber": 35,
                "Nationality": "Slovenia"
            },
            {
                "FirstName": "Juan",
                "LastName": "Palomino Morón",
                "Position": "Left Back",
                "JerseyNumber": 44,
                "Nationality": "Spain"
            },
            {
                "FirstName": "Dika",
                "LastName": "Mem",
                "Position": "Right Back",
                "JerseyNumber": 82,
                "Nationality": "France"
            },
            {
                "FirstName": "Domen",
                "LastName": "Makuc",
                "Position": "Centre Back",
                "JerseyNumber": 10,
                "Nationality": "Slovenia"
            },
            {
                "FirstName": "Luis Diogo",
                "LastName": "Da Sousa Frade",
                "Position": "Line Player",
                "JerseyNumber": 20,
                "Nationality": "Portugal"
            }
        ]
    },
    {
        "ClubName": "HC Zagreb",
        "Country": "Croatia",
        "PhoneNumber": "+385 95 9999303",
        "Email": "info@rk-zagreb.hr",
        "YearEstablished": 1922,
        "HomeArena": "Arena Zagreb",
        "League": "Premijer liga",
        "ChampionshipsWon": 76,
        "Website": "www.rk-zagreb.hr",
        "TeamColors": {
            "Light": "White",
            "Dark": "Blue"
        },
        "HeadCoach": {
            "FirstName": "Andrija",
            "LastName": "Nikolić"
        },
        "Players": [
            {
                "FirstName": "Ante",
                "LastName": "Grbavac",
                "Position": "Goalkeeper",
                "JerseyNumber": 47,
                "Nationality": "Bosnia and Herzegovina"
            },
            {
                "FirstName": "Davor",
                "LastName": "Ćavar",
                "Position": "Left Wing",
                "JerseyNumber": 24,
                "Nationality": "Croatia"
            },
            {
                "FirstName": "Filip",
                "LastName": "Glavaš",
                "Position": "Right Wing",
                "JerseyNumber": 10,
                "Nationality": "Croatia"
            },
            {
                "FirstName": "Niko",
                "LastName": "Franković",
                "Position": "Left Back",
                "JerseyNumber": 71,
                "Nationality": "Croatia"
            },
            {
                "FirstName": "Luka Lovre",
                "LastName": "Klarica",
                "Position": "Right Back",
                "JerseyNumber": 5,
                "Nationality": "Croatia"
            },
            {
                "FirstName": "Ihar",
                "LastName": "Bialiauski",
                "Position": "Centre Back",
                "JerseyNumber": 44,
                "Nationality": "Belarus"
            },
            {
                "FirstName": "Adin",
                "LastName": "Faljić",
                "Position": "Line Player",
                "JerseyNumber": 34,
                "Nationality": "Bosnia and Herzegovina"
            }
        ]
    },
    {
        "ClubName": "Kolstad Håndbold",
        "Country": "Norway",
        "PhoneNumber": "+47 90151568",
        "Email": "jostein.sivertsen@kolstad-handball.no",
        "YearEstablished": 1972,
        "HomeArena": "Trondheim Spektrum",
        "League": "REMA 1000-ligaen",
        "ChampionshipsWon": 2,
        "Website": "www.kolstad-handball.no",
        "TeamColors": {
            "Light": "White",
            "Dark": "Red"
        },
        "HeadCoach": {
            "FirstName": "Christian",
            "LastName": "Berge"
        },
        "Players": [
            {
                "FirstName": "Torbjørn Sittrup",
                "LastName": "Bergerud",
                "Position": "Goalkeeper",
                "JerseyNumber": 6,
                "Nationality": "Norway"
            },
            {
                "FirstName": "Adrian",
                "LastName": "Aalberg",
                "Position": "Left Wing",
                "JerseyNumber": 7,
                "Nationality": "Norway"
            },
            {
                "FirstName": "Sigvaldi Björn",
                "LastName": "Gudjonsson",
                "Position": "Right Wing",
                "JerseyNumber": 48,
                "Nationality": "Iceland"
            },
            {
                "FirstName": "Simon",
                "LastName": "Jeppsson",
                "Position": "Left Back",
                "JerseyNumber": 42,
                "Nationality": "Sweden"
            },
            {
                "FirstName": "Aksel",
                "LastName": "Hald",
                "Position": "Right Back",
                "JerseyNumber": 2,
                "Nationality": "Norway"
            },
            {
                "FirstName": "Sander",
                "LastName": "Sagosen",
                "Position": "Centre Back",
                "JerseyNumber": 23,
                "Nationality": "Norway"
            },
            {
                "FirstName": "Magnus",
                "LastName": "Gullerud",
                "Position": "Line Player",
                "JerseyNumber": 14,
                "Nationality": "Norway"
            }
        ]
    },
    {
        "ClubName": "Dinamo Bucuresti",
        "Country": "Romania",
        "PhoneNumber": "+40 21 2101288",
        "Email": "office@csdinamo.ro",
        "YearEstablished": 1953,
        "HomeArena": "Sala Polivalentă Dinamo",
        "League": "Liga Națională",
        "ChampionshipsWon": 36,
        "Website": "www.csdinamo.eu",
        "TeamColors": {
            "Light": "White",
            "Dark": "Red"
        },
        "HeadCoach": {
            "FirstName": "David",
            "LastName": "Davis Camara"
        },
        "Players": [
            {
                "FirstName": "Vladimir",
                "LastName": "Cupara",
                "Position": "Goalkeeper",
                "JerseyNumber": 1,
                "Nationality": "Serbia"
            },
            {
                "FirstName": "Nicusor Andrei",
                "LastName": "Negru",
                "Position": "Left Wing",